{
  "schema_version": "1.0",
  "id": "934410db-e37b-4cee-9d20-e526811020fe",
  "name": "2025 Topps Series 1",
  "slug": "2025-topps-series-1",
  "sport": "baseball",
  "year": 2025,
  "manufacturer": "Topps",
  "checklists": [
    {
      "file": "base.csv",
      "name": "Base",
      "kind": "base",
      "card_count": 350
    }
  ],
  "provenance": [
    {
      "source_type": "manufacturer-pdf",
      "source": "Topps official checklist PDF: 2025_Topps_Series_1_BB_Checklist_-_updated.pdf",
      "retrieved": "2026-08-04",
      "covers": "Series 1 (#1-350)",
      "notes": "Card #4 name repaired from interleaved PDF text extraction ('Christian Encarnacion-StraCnindcinnati Reds' -> 'Christian Encarnacion-Strand' + 'Cincinnati Reds', deterministic rightmost-subsequence removal). 370 printed lines collapse to 350 cards: the 10 League Leaders cards print one line per player."
    }
  ],
  "verified": false,
  "notes": "Half a set: predates the one-set-per-year model, and should be rebuilt as \"2025 Topps\" with Series 2 (#351-700) merged in, the way 2026 Topps is."
}
